{
  "$schema": "../../../../../schemas/type-style.schema.json",
  "schemaVersion": "1.0.0",
  "id": "IOS-004-TYPE-STYLE-CATALOG",
  "status": "role-inventory-approved-no-values-mapped",
  "styles": [
    {
      "name": "typography.semantic.display.default",
      "role": "display",
      "familyIntent": "sans",
      "sizeMapping": null,
      "weightIntent": "emphasis",
      "lineHeightIntent": "display",
      "letterSpacingIntent": "font-default-or-reviewed",
      "paragraphSpacingIntent": "not-applicable",
      "responsiveBehavior": "may-step-down-in-compact-context",
      "features": [],
      "status": "role-approved-mapping-pending"
    },
    {
      "name": "typography.semantic.heading.default",
      "role": "heading",
      "familyIntent": "sans",
      "sizeMapping": null,
      "weightIntent": "hierarchy",
      "lineHeightIntent": "heading",
      "letterSpacingIntent": "font-default-or-reviewed",
      "paragraphSpacingIntent": "not-applicable",
      "responsiveBehavior": "limited-context-remapping",
      "features": [],
      "status": "role-approved-mapping-pending"
    },
    {
      "name": "typography.semantic.title.default",
      "role": "title",
      "familyIntent": "sans",
      "sizeMapping": null,
      "weightIntent": "hierarchy",
      "lineHeightIntent": "heading",
      "letterSpacingIntent": "font-default",
      "paragraphSpacingIntent": "not-applicable",
      "responsiveBehavior": "stable-or-one-step-context-remap",
      "features": [],
      "status": "role-approved-mapping-pending"
    },
    {
      "name": "typography.semantic.body.default",
      "role": "body",
      "familyIntent": "sans",
      "sizeMapping": null,
      "weightIntent": "reading",
      "lineHeightIntent": "body",
      "letterSpacingIntent": "font-default",
      "paragraphSpacingIntent": "composition-owned-pending",
      "responsiveBehavior": "stable-default",
      "features": [],
      "status": "role-approved-mapping-pending"
    },
    {
      "name": "typography.semantic.label.default",
      "role": "label",
      "familyIntent": "sans",
      "sizeMapping": null,
      "weightIntent": "control-clarity",
      "lineHeightIntent": "compact-readable",
      "letterSpacingIntent": "font-default",
      "paragraphSpacingIntent": "not-applicable",
      "responsiveBehavior": "stable-and-wrappable",
      "features": [],
      "status": "role-approved-mapping-pending"
    },
    {
      "name": "typography.semantic.caption.default",
      "role": "caption",
      "familyIntent": "sans",
      "sizeMapping": null,
      "weightIntent": "supporting",
      "lineHeightIntent": "compact-readable",
      "letterSpacingIntent": "font-default",
      "paragraphSpacingIntent": "not-applicable",
      "responsiveBehavior": "stable-supporting-only",
      "features": [],
      "status": "role-approved-mapping-pending"
    },
    {
      "name": "typography.semantic.code.default",
      "role": "code",
      "familyIntent": "mono",
      "sizeMapping": null,
      "weightIntent": "reading",
      "lineHeightIntent": "code-readable",
      "letterSpacingIntent": "font-default",
      "paragraphSpacingIntent": "composition-owned",
      "responsiveBehavior": "scroll-or-governed-wrap",
      "features": ["ligature-policy-pending", "slashed-zero-review"],
      "status": "role-approved-mapping-pending"
    },
    {
      "name": "typography.semantic.numeric.default",
      "role": "numeric",
      "familyIntent": "sans",
      "sizeMapping": null,
      "weightIntent": "data-emphasis",
      "lineHeightIntent": "data-readable",
      "letterSpacingIntent": "font-default",
      "paragraphSpacingIntent": "not-applicable",
      "responsiveBehavior": "context-mapped",
      "features": ["tabular-nums-candidate"],
      "status": "role-approved-mapping-pending"
    },
    {
      "name": "typography.semantic.data-table.default",
      "role": "data-table",
      "familyIntent": "sans",
      "sizeMapping": null,
      "weightIntent": "dense-reading",
      "lineHeightIntent": "dense-readable",
      "letterSpacingIntent": "font-default",
      "paragraphSpacingIntent": "not-applicable",
      "responsiveBehavior": "dense-context-only",
      "features": ["tabular-nums-where-numeric"],
      "status": "role-approved-mapping-pending"
    },
    {
      "name": "typography.semantic.button-text.default",
      "role": "button-text",
      "familyIntent": "sans",
      "sizeMapping": null,
      "weightIntent": "control-clarity",
      "lineHeightIntent": "control-readable",
      "letterSpacingIntent": "font-default",
      "paragraphSpacingIntent": "not-applicable",
      "responsiveBehavior": "stable-and-wrappable",
      "features": [],
      "status": "role-approved-mapping-pending"
    },
    {
      "name": "typography.semantic.input-text.default",
      "role": "input-text",
      "familyIntent": "sans",
      "sizeMapping": null,
      "weightIntent": "reading",
      "lineHeightIntent": "control-readable",
      "letterSpacingIntent": "font-default",
      "paragraphSpacingIntent": "not-applicable",
      "responsiveBehavior": "stable-default",
      "features": [],
      "status": "role-approved-mapping-pending"
    },
    {
      "name": "typography.semantic.helper-text.default",
      "role": "helper-text",
      "familyIntent": "sans",
      "sizeMapping": null,
      "weightIntent": "supporting",
      "lineHeightIntent": "compact-readable",
      "letterSpacingIntent": "font-default",
      "paragraphSpacingIntent": "composition-owned",
      "responsiveBehavior": "stable-and-wrappable",
      "features": [],
      "status": "role-approved-mapping-pending"
    },
    {
      "name": "typography.semantic.validation-text.default",
      "role": "validation-text",
      "familyIntent": "sans",
      "sizeMapping": null,
      "weightIntent": "supporting-emphasis",
      "lineHeightIntent": "compact-readable",
      "letterSpacingIntent": "font-default",
      "paragraphSpacingIntent": "composition-owned",
      "responsiveBehavior": "stable-never-truncated",
      "features": ["non-color-cue-required"],
      "status": "role-approved-mapping-pending"
    }
  ]
}
